{
  "$schema": "./catalog.schema.json",
  "schemaVersion": 1,
  "generatedAt": "2026-10-17T00:00:00Z",
  "repository": "https://github.com/jamjam1312/LOKROOS-Appstore-githubconnection",
  "items": [
    {
      "id": "gimp",
      "kind": "application",
      "name": "GIMP",
      "summary": "Professionelle Bildbearbeitung",
      "description": "Leistungsfähige freie Bildbearbeitung für Retusche, Ebenen, Masken und Grafikexport.",
      "categories": ["Grafik", "Kreativwerkzeuge"],
      "icon": "assets/icons/gimp.png",
      "homepage": "https://www.gimp.org/",
      "source": "https://gitlab.gnome.org/GNOME/gimp",
      "license": "GPL-3.0-or-later AND LGPL-3.0-or-later",
      "featured": true,
      "install": {"method": "flatpak", "remote": "flathub", "ref": "org.gimp.GIMP"}
    },
    {
      "id": "krita",
      "kind": "application",
      "name": "Krita",
      "summary": "Digitales Malen und Zeichnen",
      "description": "Freies Mal- und Illustrationsprogramm mit Pinseln, Animation und Grafiktablett-Unterstützung.",
      "categories": ["Grafik", "Kreativwerkzeuge"],
      "icon": "assets/icons/krita.png",
      "homepage": "https://krita.org/",
      "source": "https://invent.kde.org/graphics/krita",
      "license": "GPL-3.0-only",
      "featured": true,
      "install": {"method": "flatpak", "remote": "flathub", "ref": "org.kde.krita"}
    },
    {
      "id": "inkscape",
      "kind": "application",
      "name": "Inkscape",
      "summary": "Professionelle Vektorgrafik",
      "description": "Freier SVG-Editor für Logos, Illustrationen, Diagramme und druckfähige Vektorgrafiken.",
      "categories": ["Grafik", "Kreativwerkzeuge"],
      "icon": "assets/icons/inkscape.png",
      "homepage": "https://inkscape.org/",
      "source": "https://gitlab.com/inkscape/inkscape",
      "license": "GPL-2.0-or-later",
      "featured": true,
      "install": {"method": "flatpak", "remote": "flathub", "ref": "org.inkscape.Inkscape"}
    },
    {
      "id": "kdenlive",
      "kind": "application",
      "name": "Kdenlive",
      "summary": "Videoschnitt und Produktion",
      "description": "Nichtlinearer freier Videoeditor mit Mehrspur-Timeline, Effekten, Proxy-Clips und Rendering.",
      "categories": ["Video", "Kreativwerkzeuge"],
      "icon": "assets/icons/kdenlive.png",
      "homepage": "https://kdenlive.org/",
      "source": "https://invent.kde.org/multimedia/kdenlive",
      "license": "GPL-3.0-only",
      "featured": true,
      "install": {"method": "flatpak", "remote": "flathub", "ref": "org.kde.kdenlive"}
    },
    {
      "id": "blender",
      "kind": "application",
      "name": "Blender",
      "summary": "3D, Animation und Compositing",
      "description": "Freie 3D-Suite für Modellierung, Animation, Simulation, Rendering und Videoschnitt.",
      "categories": ["3D", "Kreativ"],
      "icon": "assets/icons/blender.png",
      "homepage": "https://www.blender.org/",
      "source": "https://projects.blender.org/blender/blender",
      "license": "GPL-3.0-or-later",
      "featured": true,
      "install": {"method": "flatpak", "remote": "flathub", "ref": "org.blender.Blender"}
    },
    {
      "id": "darktable",
      "kind": "application",
      "name": "darktable",
      "summary": "RAW-Fotografie und Entwicklung",
      "description": "Freier RAW-Workflow und digitale Dunkelkammer mit zerstörungsfreier Bearbeitung.",
      "categories": ["Foto", "Kreativwerkzeuge"],
      "icon": "assets/icons/darktable.png",
      "homepage": "https://www.darktable.org/",
      "source": "https://github.com/darktable-org/darktable",
      "license": "GPL-3.0-or-later",
      "featured": false,
      "install": {"method": "flatpak", "remote": "flathub", "ref": "org.darktable.Darktable"}
    },
    {
      "id": "audacity",
      "kind": "application",
      "name": "Audacity",
      "summary": "Audio aufnehmen und bearbeiten",
      "description": "Freier Mehrspur-Audioeditor für Aufnahme, Schnitt, Effekte und viele Audioformate.",
      "categories": ["Audio", "Kreativ"],
      "icon": "assets/icons/audacity.png",
      "homepage": "https://www.audacityteam.org/",
      "source": "https://github.com/audacity/audacity",
      "license": "GPL-3.0-only",
      "featured": false,
      "install": {"method": "flatpak", "remote": "flathub", "ref": "org.audacityteam.Audacity"}
    },
    {
      "id": "libreoffice",
      "kind": "application",
      "name": "LibreOffice",
      "summary": "Freies Office-Paket",
      "description": "Freies Paket für Texte, Tabellen, Präsentationen, Zeichnungen, Formeln und Datenbanken.",
      "categories": ["Büro", "Office-Werkzeuge"],
      "icon": "assets/icons/libreoffice.png",
      "homepage": "https://www.libreoffice.org/",
      "source": "https://git.libreoffice.org/core",
      "license": "MPL-2.0",
      "featured": true,
      "install": {"method": "flatpak", "remote": "flathub", "ref": "org.libreoffice.LibreOffice"}
    },
    {
      "id": "vlc",
      "kind": "application",
      "name": "VLC",
      "summary": "Universeller Medienplayer",
      "description": "Freier Medienplayer für zahlreiche Audio-, Video- und Streaming-Formate.",
      "categories": ["Video", "Audio"],
      "icon": "assets/icons/vlc.png",
      "homepage": "https://www.videolan.org/vlc/",
      "source": "https://code.videolan.org/videolan/vlc",
      "license": "GPL-2.0-or-later",
      "featured": false,
      "install": {"method": "flatpak", "remote": "flathub", "ref": "org.videolan.VLC"}
    },
    {
      "id": "prismlauncher",
      "kind": "application",
      "name": "Prism Launcher",
      "summary": "Freier Launcher für Minecraft-Instanzen",
      "description": "Verwaltet getrennte Minecraft-Instanzen, Mods und Java-Versionen. Minecraft selbst und ein berechtigtes Konto sind nicht enthalten.",
      "categories": ["Gaming", "Minecraft"],
      "icon": "assets/icons/prismlauncher.png",
      "homepage": "https://prismlauncher.org/",
      "source": "https://github.com/PrismLauncher/PrismLauncher",
      "license": "GPL-3.0-only",
      "featured": true,
      "install": {"method": "flatpak", "remote": "flathub", "ref": "org.prismlauncher.PrismLauncher"}
    },
    {
      "id": "obs-studio",
      "kind": "application",
      "name": "OBS Studio",
      "summary": "Aufnehmen und streamen",
      "description": "Freie Software für Bildschirmaufnahme, Szenen, Quellen und Livestreaming.",
      "categories": ["Video", "Streaming"],
      "icon": "assets/icons/obs.png",
      "homepage": "https://obsproject.com/",
      "source": "https://github.com/obsproject/obs-studio",
      "license": "GPL-2.0-or-later",
      "featured": false,
      "install": {"method": "flatpak", "remote": "flathub", "ref": "com.obsproject.Studio"}
    },
    {
      "id": "lokro-monochrome-large-cursor",
      "kind": "design-pack",
      "name": "LOKRO Monochrome – Large Cursor",
      "summary": "LOKRO-Dunkeldesign mit besser sichtbarem Mauszeiger",
      "description": "Erstes prüfbares LOKRO-Design-Pack. Es nutzt ausschließlich bereits installierte LOKRO- und Breeze-Komponenten und setzt den Mauszeiger auf 32 Pixel. Das Archiv enthält keine Skripte oder ausführbaren Dateien.",
      "categories": ["Design", "Barrierearm", "LOKRO"],
      "icon": "assets/icons/lokro-design-pack.svg",
      "homepage": "https://github.com/jamjam1312/LOKROOS-Arch-based/blob/main/docs/DESIGN_PACKS.md",
      "source": "https://github.com/jamjam1312/LOKROOS-Appstore-githubconnection/tree/v0.1.0-alpha.6/catalog/packs-src/org.lokro.monochrome-large-cursor",
      "license": "CC-BY-SA-4.0",
      "featured": true,
      "install": {
        "method": "lokro-design-pack",
        "url": "https://raw.githubusercontent.com/jamjam1312/LOKROOS-Appstore-githubconnection/v0.1.0-alpha.6/catalog/packs/org.lokro.monochrome-large-cursor-1.0.0.lokrodesign",
        "sha256": "8c039c36e67c3f8cce3d00a712ca88138298cacb721cdef7096f85797be1b7e0"
      }
    },
    {
      "id": "artcraft-launcher",
      "kind": "application",
      "name": "ArtCraft Launcher 0.3.2 (Alpha)",
      "summary": "Ein Launcher für eine einheitliche Kreativ- und Office-Suite",
      "description": "Experimentelle Rust-Suite mit PhotoCraft, VectorCraft, FilmCraft, EffectCraft, DesignCraft, PDFCraft, WordCraft, GridCraft und DeckCraft. LOKRO lädt ausschließlich das festgelegte offizielle x86_64-Flatpak-Bundle und prüft vor der Installation dessen SHA-256.",
      "categories": ["Experimentell", "Kreativwerkzeuge", "Office-Werkzeuge"],
      "icon": "assets/icons/artcraft-launcher.svg",
      "homepage": "https://getartcraft.com/",
      "source": "https://github.com/storytold/craft-launcher",
      "license": "MIT OR Apache-2.0",
      "featured": false,
      "install": {
        "method": "flatpak-bundle",
        "ref": "ai.storyteller.artcraft-launcher",
        "url": "https://github.com/storytold/craft-launcher/releases/download/v0.3.2/artcraft-launcher-0.3.2-linux-x86_64.flatpak",
        "sha256": "67d135d290117b345b9a6ae3cab4391587cae3fa178a8abfcc2cd8e3f2d35d92"
      }
    }
  ]
}
